ID	Authors	Title	Link	Venue	full paper/ short	year	ElicitationIEEE International Requirements Engineering Conference Workshops	REW																															
IEEE International Conference on Evaluation of Novel Approaches to Software Engineering 	ENASE																															
IFIP WG 8.1 Working Conference on the Practice of Enterprise Modeling	PoEM																															
International Conference on Business Process Management	BPM																															
 IEEE International Symposium on Systems Engineering	ISSE																															
IEEE SoutheastCon	SoutheastCon																															
Proceeding International Conference on Intelligent Data Communication Technologies and Internet of Things 	IDCIoT																															
 IEEE Aerospace Conference	Aerospace Conf																															